,tconst,originalTitle,startYear,runtimeMinutes,genres_x,adult,overview,production_countries,production_companies_name,production_companies_country,averageRating,numVotes,directors,writers
349,tt0875113,99 francs,2007,100.0,"Comedy,Drama",False,"Paris, France, 2001. Octave Parango, a young advertiser working at the Ross & Witchcraft advertising agency, lives a suicidal existence, ruled by cynicism, irresponsibility and debauchery. The obstacles he will encounter in developing a campaign for a new yogurt brand will force him to face the meaning of his work and the way he manages his relationship with those who orbit around his egotistic lifestyle.",['FR'],"['Pathé Distribution', 'Légende Films', 'ARTE France Cinéma', 'Canal+', 'CinéCinéma', 'Poste Image', 'Cofimage 18', 'Uni Etoile 4']","['FR', 'FR', 'FR', 'FR', 'FR', '', '', '']",7.2,20521,nm0468007,"nm3299329,nm3298144,nm0468007,nm0067166"
350,tt0880440,L'auberge rouge,2007,95.0,"Comedy,Crime",False,"A group of travelers, including a monk, stay in a lonely inn in the mountains. The host confesses the monk his habit of serving poisoned soup to the guests, to rob their possessions and to bury them in the backyard. The story unfolds as the monk tries to save the guest's lives without violating the holy secrecy of the confession.",['FR'],['Warner Bros. Pictures'],['US'],5.9,1412,nm0470443,"nm0002010,nm0217033,nm0042179,nm0098204,nm0002193"
351,tt0881343,La vérité ou presque,2007,95.0,"Comedy,Drama",False,Anne is an attractive woman on the cusp of middle age trying in vain to divide her time fairly between her demanding job as a television presenter and her family. Her colleagues and friends have similar problems though.,['FR'],"['Canal+', 'France 2 Cinéma', 'Les Films A4', 'TPS Star', 'Auvergne-Rhône-Alpes Cinéma']",,5.8,229,nm0439748,"nm0565522,nm0064503,nm0439748"
352,tt0887887,Le coeur des hommes 2,2007,115.0,"Comedy,Drama,Romance",False,"Alex, Antoine, Jeff and Manu. Four friends, four years later. Their relationships, friendship, shared secrets, feelings of guilt and their desire to change and improve.",['FR'],['Pierre Javaux Productions'],['FR'],5.9,819,nm0261181,nm0261181
353,tt0887901,Détrompez-vous,2007,88.0,Comedy,False,"When a man &amp; woman discover their spouses are having an affair with each other, they secretly plot to break them up and win them back",['FR'],[],,6.0,766,nm0214621,"nm0214621,nm0494370"
354,tt0889606,L'heure zéro,2007,104.0,"Comedy,Mystery",False,"Inviting the ex-wife to a family reunion when the none-too-secure new wife will be there hardly seems to be a recipe for success, and true to form, bodies have begun to stack up by the end of this cinematic update of a classic Agatha Christie tale. Luckily for the extended clan gathered at a sumptuous waterfront estate in Northern France, Inspector Martin Bataille is on hand to find out not only ""who done it"" but why.",['FR'],[],[],5.8,673,nm0859323,"nm1206664,nm0147144,nm0002005,nm0245087,nm0480727"
355,tt0889665,Steak,2007,82.0,Comedy,False,"George is the scapegoat of his classmates. One day he cracks and shoots them. His best and only friend Blaise is accused in his place and sentenced to 7 years in a psychiatric hospital. At the day of his release, Blaise realizes he only has one family: his best friend George. But he does not want to hear about his childhood friend, as he tries to integrate with the “Chivers” a gang whose members wear red jackets and boots, drink milk, drive sport trucks and play an incomprehensible and violent game that mixes cricket and mental arithmetic.",['FR'],[],,5.9,2761,nm1189197,nm1189197
356,tt0910911,Ma vie n'est pas une comédie romantique,2007,92.0,"Comedy,Romance",False,"In this romantic comedy Thomas moves back in with his parents after his girlfriend throws him out. He runs into Florence, an old school friend, who invites him to dinner with her husband and two children.",['FR'],[],,5.8,605,nm1164782,"nm1164782,nm1773682"
357,tt0920473,Un baiser s'il vous plaît,2007,96.0,"Comedy,Romance",False,"When Gabriel and Emilie meet by chance, he offers her a ride, and they spend the evening talking, laughing and getting along famously. At the end of the night, Emilie declines Gabriel's offer of ""a kiss without consequences"". Emilie admonishes him that the kiss could have unexpected consequences, and tells him a story, unfolding in flashbacks, about the impossibility of indulging your desires without affecting someone else's life.",['FR'],"['Moby Dick Films', 'ARTE France Cinéma', 'TPS Star']","['FR', 'FR', 'FR']",6.7,2652,nm0609981,nm0609981
358,tt0922366,"Blanche Neige, la suite",2007,82.0,"Animation,Comedy,Fantasy",False,"Prince Charming was supposed to live long and happily with Snow White after kissing her back to life. However the jealous 'good' fairy decides that she and the prince were meant to be, only the start of a whole series of perversions of various fairy tale characters' traditional good nature.","['GB', 'FR', 'PL', 'BE']","['YC Alligator Film', 'Tchin Tchin Productions', 'Steve Walsh Productions', 'DeFamilieJanssen']",,4.7,471,nm0681617,"nm0376676,nm0681617"
359,tt0961097,Un monstre à Paris,2011,90.0,"Adventure,Animation,Comedy",False,"Paris, 1910. Emile, a shy movie projectionist, and Raoul, a colourful inventor, find themselves embarked on the hunt for a monster terrorizing citizens. They join forces with Lucille, the big-hearted star of the Bird of Paradise cabaret, an eccentric scientist and his irascible monkey to save the monster, who turns out to be an oversized but harmless flea, from the city's ruthlessly ambitious police chief.",['FR'],"['EuropaCorp', 'Bibo Films', 'France 3 Cinéma', 'Walking The Dog']",,6.7,22299,nm0074426,"nm0443592,nm0074426"
360,tt0973844,Chacun son cinéma ou Ce petit coup au coeur quand la lumière s'éteint et que le film commence,2007,100.0,"Comedy,Drama",False,A collective film of 33 shorts directed by different directors about their feeling about cinema.,['FR'],"['Elzévir Films', 'Cannes Film Festival']",,6.8,5350,"nm0000766,nm0000801,nm0000806,nm0001005,nm0149631,nm0155280,nm0001047,nm0001053,nm0001054,nm0000343,nm0201094,nm0201095,nm0210701,nm0220019,nm0000382,nm0321159,nm0396284,nm0327944,nm0442454,nm0452102,nm0001429,nm0464846,nm0500988,nm0516360,nm0000186,nm0158857,nm0604335,nm0000591,nm0749914,nm0758574,nm0837839,nm0001814,nm0001885,nm0000694,nm0939182,nm0955443","nm0210701,nm0000382,nm0000801,nm0151858,nm0201094,nm0201095,nm0321159,nm0327944,nm0442454,nm0464846,nm0604335,nm0939182,nm0955443,nm1802940"
361,tt0977647,Deux vies... plus une,2007,90.0,"Comedy,Romance",False,"Everyone knows that Eliane Weiss is dedicated in everything she does, from her husband, to her daughter and pupils. But not everyone knows that she longs for more - more time for her, more fun, more thrills.  So when she decides to start working on her passion, writing, and incidentally meets an attractive publisher, everyone is taken by surprise. As their seemingly perfect life starts to fall apart, everyone will have to readjust to the new Eliane Weiss.",['FR'],['Les Films du Kiosque'],,5.5,124,nm0147544,"nm0147544,nm0584962"
362,tt0985107,Vous êtes de la police?,2007,94.0,"Comedy,Crime",False,"A former policeman resentfully enters a retirement home. To deceive his boredom, he will investigate the murder of another resident.","['BE', 'FR']",['Memento Films Production'],,6.1,63,nm1440861,"nm2699119,nm1440861"
363,tt0991272,Comme ton père,2007,95.0,"Comedy,Drama",False,"1968. La famille Maïmon : Félix, Mireille et leurs deux enfants, Eric et Michel, débarquent à Marseille. Quelques années plus tard, à peine installé à Belleville, Félix fait la connaissance de Serge, un parrain local avec qui il se lie d'amitié. Serge entraîne Félix sur les chemins du grand banditisme, jusqu'à ce que celui-ci se fasse prendre par la police et décide d'endosser, à la place de Serge, la responsabilité de chef de bande.","['FR', 'IL']",['Mercredi Films'],,5.2,132,nm2345939,"nm0030189,nm2345939,nm2920848,nm5554419"
364,tt0991350,Les randonneurs à Saint-Tropez,2008,105.0,Comedy,False,"Ten years after their disastrous walking holiday in Corsica, four friends – Cora, Nadine, Mathieu and Louis – decide to spend the summer together on the Côte d’Azur. To their surprise, who should they meet in St-Tropez but Eric, the guide-from-Hell who transformed their last holiday into a nightmare and whom they swore never to see again...",['FR'],[],[],4.6,586,nm0362854,"nm0039903,nm2604734,nm0362854"
365,tt1000091,Didine,2008,103.0,Comedy,False,"Alexandrine, 35, who everyone nicknames Didine, peacefully goes with the flow, the opposite of her best friend Muriel. In this way, she one day crosses the threshold of a elderly person caregivers’ agency where, faced with an extrovert teenager, a charming man, and a cruel, elderly woman, she takes hold of her existence and encounters love.",['FR'],[],[],6.2,159,nm0226303,"nm0226303,nm0494504"
366,tt10023150,Mon cousin,2020,104.0,Comedy,False,"Pierre is the highly successful CEO of a large family-owned company. Before signing the deal of the century, he has to settle one last formality: obtain the signature of his cousin Adrien who owns 50% of his firm. This sweet, idealistic dreamer, who makes one blunder after another, is so happy to see Pierre again that he wants to spend time with him and delay the moment of signing. So Pierre has no choice but to take his cousin with him on a turbulent business trip during which his patience will be put to the test.",['FR'],"['Eskwad', 'TF1 Films Production', 'uMedia', 'uFund']","['FR', 'FR', 'BE', 'BE']",5.3,668,nm0468007,"nm0736676,nm0468007,nm0512071"
367,tt1002966,Ca$h,2008,100.0,"Comedy,Crime,Thriller",False,"A man meets up with two ""good guys"" to recover what is unlawfully his, taking them on his whirlwind ride, doing things they never would have imagined, just to survive.",['FR'],"['Pulsar productions', 'Canal+', 'TF1 Films Production']","['', 'FR', 'FR']",5.9,5029,nm0078704,nm0078704
368,tt1003027,Notre univers impitoyable,2008,87.0,Comedy,False,,['FR'],"['Haut et Court', 'M6 Films']","['FR', 'FR']",5.8,437,nm1481060,nm1481060
369,tt10115562,Chambre 212,2019,86.0,Comedy,False,"After 20 years of marriage, Maria decides to leave her husband. She moves into room 212 at the hotel across the street, with a bird’s-eye view of her apartment, her husband and the life she shared with him. While she wonders if she made the right decision, many of the people in her life offer their opinions on the matter. They intend to let her know, whether she likes it or not, on what proves to be a life-changing evening.","['BE', 'FR', 'LU']","['Les Films Pelléas', 'K-Tiousha', 'Bidibul Productions', 'France 2 Cinéma', 'SCOPE Pictures']","['FR', '', 'LU', 'FR', 'BE']",6.0,2287,nm0393394,nm0393394
370,tt10143114,Premier de la classe,2019,82.0,Comedy,False,,"['BE', 'FR']","['Les Films du 24', 'uMedia', 'M6 Films', 'UGC']","['FR', 'BE', 'FR', 'FR']",5.2,194,nm1988254,nm1988254
371,tt10143308,Tout nous sourit,2020,101.0,Comedy,False,"The members of an apparently happy couple, each with their respective lovers, have the same idea: spending the weekend at their holiday home. Finding each other there is only the beginning of an awkward and hilarious weekend.",['FR'],['A Single Man Productions'],['FR'],5.4,334,nm4193380,"nm4193380,nm2541107"
372,tt10143498,Mon chien Stupide,2019,106.0,"Comedy,Drama",False,"Henri is a middle-aged writer with fading inspiration who has published nothing worthy of note in years. Feeling increasingly misunderstood by his wife and four grown up deadbeat kids, he dreams of running away to start over again. Yet when he discovers an unattractive, bad-mannered dog in his garden, he decides to adopt him and both start developing an unexpected friendship that inevitably upsets Henri’s family and neighbors.","['BE', 'FR']","['Same Player', 'Good Time Productions', 'StudioCanal']","['FR', '', 'FR']",6.2,2267,nm0040939,"nm0266899,nm1918877,nm0040939,nm9177529,nm0347136"
373,tt10152488,Un coup de maître,2023,95.0,Comedy,False,"Willing to risk it all, an unscrupulous art dealer and his socially-awkward painter and longtime friend develop an extreme and ludicrous plan to save themselves.","['BE', 'FR']","['Mandarin Production', 'KinoVista', 'SCOPE Pictures', 'France 2 Cinéma']","['FR', 'FR', 'BE', 'FR']",6.0,104,nm1462495,"nm1462495,nm3321995,nm1287124,nm4554522"
374,tt10183616,Yves,2019,107.0,"Comedy,Sci-Fi",False,"Jerem decides to settle at his grandma’s place to compose his first album. There he meets So, a mysterious investigator working on behalf of the startup Digital Cool.  She will persuade Jerem to try out Yves, a new kind of smart refrigerator gifted with an IA.",['FR'],"['Ecce Films', 'Le Pacte']","['FR', 'FR']",5.5,636,nm2254779,nm2254779
375,tt10196398,Adieu les cons,2020,87.0,"Comedy,Drama",False,"When 43-year-old hairdresser Suze Trappet finds out that she's seriously ill, she decides to go looking for a child she was forced to abandon when she was only 15. On her madcap bureaucratic quest she crosses paths with JB, a 50-year-old man in the middle of a burnout, and Mr. Blin, a blind archivist prone to overenthusiasm. The unlikely trio set off on a hilarious and poignant helterskelter journey across the city in search of Suze's long-lost child.",['FR'],"['Gaumont', 'Manchester Films', 'France 2', 'Canal+', 'Entourage Pictures', 'ADCB Films', 'CNC', 'Ciné+', 'France Télévisions', 'Mikros Image', 'La Région Île-de-France']","['FR', 'FR', 'FR', 'FR', 'FR', 'FR', 'FR', 'FR', 'FR', 'FR', 'FR']",6.7,6392,nm0243355,"nm0243355,nm0738925,nm5473573"
376,tt10223546,Tu mérites un amour,2019,102.0,"Comedy,Drama,Romance",False,"Lila has just broken up with her cheating boyfriend and is disappointed, frustrated and hurt. Looking for love and intimacy, she engages in a series of short-term relationships, while her friends offer up bad advice and her ex tries to win her back.",['FR'],"['Les films de la bonne Mère', 'ARTE France Cinéma', 'ARTE']","['FR', 'FR', 'FR']",6.1,803,nm2082567,nm2082567
377,tt10228204,Perdrix,2019,99.0,"Comedy,Drama,Romance",False,"Pierre Perdrix has been enjoying an enchanted though restless existence since the enigmatic Juliette Webb burst into his life. a stranger who landed in his family's unique world like a meteorite, and who by her presence alone will force this tight-knit microcosm to redefie their boundaries and finally begin to fully live their lives.",['FR'],['Domino Films'],['FR'],6.3,1183,nm4870005,"nm4870005,nm5506336"
378,tt10233406,Les blagues de Toto,2020,84.0,"Comedy,Family",False,"Back-to-school! For troublemaker Toto, it’s the best playground for fooling around. When a sculpture collapses during the opening of a museum, Toto is immediately blamed.  To prove his innocence, Toto has no other option but making a pact with Igor, the school nerd. In exchange for his help, Toto will help Igor being cool.  The unlikely duo turns into little detectives. A fun and exciting adventure begins…",['FR'],"['Superprod', 'SND', 'Bidibul Productions']","['FR', 'FR', 'LU']",3.9,171,nm0099797,"nm2564025,nm1105699,nm2059904,nm10745352"
379,tt1024896,"Ce soir, je dors chez toi",2007,84.0,"Comedy,Romance",False,"Alex and Laetitia appear to make the perfect couple. But, as much as he loves his gorgeous fun-loving sweetheart, Alex isn’t yet ready for her to move in with him. Laetitia has other ideas. She has already packed her bags and lets Alex know that she will be taking up residence in his apartment within a few hours. For Alex, this is his worst nightmare come true. In desperation, he persuades his best friend to simulate an attack of depression so that he can move in with him...",['FR'],"['Alter Films', 'KL Productions', 'SPAD Films']","['FR', '', '']",5.1,775,nm0057842,"nm0057842,nm0061085,nm0217033"
380,tt1024899,Enfin veuve,2007,93.0,"Comedy,Drama,Romance",False,"Anne-Marie lives an easy life with Gilbert, a rich plastic surgeon: a beautiful house, a doggy, a cleaning lady, expensive furniture, the lot. Not so easy in fact when she thinks twice. She does not get on with her husband any longer. She gets on his nerves and he does not attract her any longer. She feels good only when she jogs on the beach and ... when she is the arms of her lover, Leo. One day, Gilbert gets killed in a car accident. Good news, since she will be able to live with Leo. The trouble is her well-meaning family settle at her villa with a view to supporting the ""poor widow"" morally. Anne-Marie just cannot admit she is not distressed at all, especially to her son Christophe. She is now even more of a prisoner than when Gilbert was alive...",['FR'],['Gaumont'],['FR'],5.4,983,nm0580698,"nm0580698,nm0368525"
381,tt10251538,10 jours sans maman,2020,104.0,"Comedy,Family",False,"Antoine is the Head of HR of a big company. Managing people is his thing, so when his overwhelmed wife suddenly decides to go on holiday and leave him with the responsibility of the house and their four kids, he knows it will be a piece of cake for him. But Antoine has drastically underestimated the mess that four mischievous kids can cause...",['FR'],"['Soyouz Films', 'StudioCanal', 'Canal+', 'Ciné+']","['FR', 'FR', 'FR', 'FR']",5.4,1078,nm0076307,"nm1033668,nm1409431,nm0893556,nm0076307,nm3457034"
382,tt10290244,Le petit Nicolas: Qu'est-ce qu'on attend pour être heureux?,2022,82.0,"Animation,Comedy,Family",False,"Somewhere between Montmartre and Saint-Germain-des-Prés, Jean-Jacques Sempé and René Goscinny lean over a large white sheet of paper and bring to life a mischievous and endearing boy, Little Nicolas. From schoolyard games and fights, to summer camp pranks and camaraderie, Nicolas lives a merry and enriching childhood.","['CA', 'FR', 'LU']","['Onyx Films', 'Bac Films', 'ON Animation Studios', 'Foliascope', 'Kaïbou', 'Film Fund Luxembourg', 'Charades', 'Bidibul Productions']","['', 'FR', 'FR', 'FR', 'CA', 'LU', 'FR', 'LU']",7.2,762,"nm5904533,nm1928263","nm1615967,nm0275260,nm1928263,nm0331453,nm1046729"
383,tt10341040,Around the World in 80 Days,2021,82.0,"Adventure,Animation,Comedy",False,"Passepartout is a young and scholarly marmoset who always dreams of becoming an explorer. One day, he crosses paths with Phileas, a reckless and greedy frog, eager to take on a bet to circumnavigate the globe in 80 days and earn 10 million clams in the process. Seizing the opportunity of a lifetime to explore the world, Passepartout embarks with his new friend on a crazy and exhilarating adventure full of twists and surprises.","['BE', 'FR']","['StudioCanal', 'Cottonwood Media', 'uMedia', 'uFund']","['FR', 'FR', 'BE', 'BE']",4.7,836,nm1361017,"nm0841532,nm0894523,nm0584813,nm6040275"
384,tt10345590,Comment je suis devenu super-héros,2020,97.0,"Action,Adventure,Comedy",False,"Paris 2020. While superheroes have assimilated into the Parisian society, they discover a new drug that gives themselves personal superpowers to mere mortals. Lieutenants Moreau and Schaltzmann are investigating the case with the support of two ex-superheroes, Monte Carlo and Callista. They'll do whatever it takes to dismantle the traffic. But Moreau's past resurfaces, and the investigation becomes more complicated.",['FR'],"['Trésor Films', 'Artémis Productions', 'Shelter Prod', 'Warner Bros. Entertainment France']","['FR', 'BE', 'BE', 'FR']",5.8,5932,nm2537631,"nm2537631,nm4992343,nm6331976,nm0029762,nm3954356"
385,tt10356734,La vertu des impondérables,2019,87.0,"Comedy,Drama,Musical",False,"That day, there’s tension in the air: Marianne has her car and dog stolen from a highway parking lot. Stéphane is constantly arguing with his wife. Noémie can no longer stand her husband Aldo’s infidelities. A little-known orchestra performs for the last time…",['FR'],"['Davis Films', 'Les Films 13']","['FR', 'FR']",4.5,77,nm0500988,"nm4085941,nm0500988"
386,tt1035729,Le bal des actrices,2009,105.0,"Comedy,Drama",False,"While shooting a documentary about all kinds of actresses, the director falls for one of them.",['FR'],['SND'],['FR'],6.5,1253,nm0494069,nm0494069
387,tt10366254,Terrible Jungle,2020,91.0,"Adventure,Comedy",False,"French Guyana, not so long ago. Eliott, a young and naive anthropology researcher, goes on an expedition to study the Otopis, a mysterious tribe from the Amazon rainforest. It is also an opportunity for him to get away from the grip of his possessive mother, Chantal de Bellabre, an ethnologist hated by the profession for her biased and cold-hearted practices. Arriving in the forest Elliot realizes the Otopis are not the “good savages” he had imagined. Alcoholic, violent, crooked: they will turn his expedition into real hell in the jungle. Fortunately, Chantal, consumed by remorse and worried about her son, decides to abandon her own expedition and goes looking for him in the jungle, with the help of the not so helpful Lieutenant-Commander Raspailles and his men.",['FR'],"['22h22', 'WY Productions', 'Apollo Films']","['FR', 'FR', 'FR']",5.4,786,"nm5339583,nm10709088","nm5339583,nm10709088"
388,tt10366428,Le sens de la famille,2020,100.0,Comedy,False,"Husband does not understand his wife? Conflict with children? Do you want to be heard and stood in your place? Be afraid of your desires. In this family, everything changed places, including grandmother.",['FR'],['Karé Productions'],['FR'],6.0,861,nm0070899,"nm0070899,nm3529400,nm1879912,nm10929127,nm2603307,nm1206845,nm0717873,nm1309397,nm0153228,nm6720438,nm1955626,nm2473226,nm0443592,nm4506893,nm1077445,nm1899620"
389,tt10369344,L'aventure des Marguerite,2020,89.0,"Comedy,Family,Fantasy",False,"Margot and Marguerite are 12-year-old girls who seem no different from any other youngsters with the usual family and peer problems. While they appear to have similar faces and body shapes, they wear different clothes and hairstyles, but the biggest difference between them is that one lives in 1942 and the other in 2020. When the girls crawled into a wooden chest they were magically sent into each other’s timeline, and because the girls look so similar their family and friends do not notice the swap.",['FR'],"['Radar Films', 'La Station', 'Orange Studio', 'Pathé', 'My Melody']","['FR', '', 'FR', 'FR', '']",6.1,300,nm1764568,"nm11197468,nm11197469,nm0443592,nm1764568,nm2056306"
390,tt10372626,Tous flics!,2022,76.0,Comedy,False,"A comedy on the theme of the law being debated where, in the face of growing insecurity and the upsurge in gratuitous violence, anyone can become a police auxiliary and thus increase the number of police officers. Each citizen will be able to defend himself by becoming a police officer.",['FR'],['Mocky Delicious Products (MDP)'],['FR'],3.3,7,nm0006620,\N
391,tt10375106,Mandibules,2020,77.0,"Comedy,Fantasy",False,Two dimwitted buddies hatch a money-making scheme after discovering an overgrown fly in the boot of a car.,"['BE', 'FR']","['Chi-Fou-Mi Productions', 'Artémis Productions', 'Memento Films Production', 'VOO', 'BeTV', 'Shelter Prod']","['FR', 'BE', 'FR', 'BE', 'BE', 'BE']",6.6,5492,nm1189197,nm1189197
392,tt10375632,C'est magnifique!,2021,98.0,"Comedy,Drama",False,"When Pierre learns that his parents are not his parents, he wants to find out who he is and where he comes from. Raised in nature, Pierre has never been confronted with society. He does not know the codes. He will team up with Anna who will help him in his quest and cross a whole gallery of characters as funny as tender. But during his investigation, Pierre will lose his colors – like a photo that fades.",['FR'],['Cine Nominé'],['FR'],6.1,332,nm0180404,"nm0180404,nm2524823,nm2056787"
393,tt10384908,Debout sur la montagne,2019,105.0,"Adventure,Comedy,Drama",False,"Hugo, Stan and Bérénice grew up together then grew apart. They were inseparable. Fifteen years later, they meet again as adults. But life has been tough on them. Will they reignite the crazy sparks of their childhood ?",['FR'],"['Gloria Films', 'Les Films du printemps']","['FR', 'FR']",5.8,171,nm1715466,nm1715466
394,tt10392128,Attention au départ !,2021,93.0,Comedy,False,"Finally, the holidays are here! Vlad and his friends are so excited! Jérôme, Vlad’s father, is in charge. André, the grandfather of Jeanne and Basile, is also here to help. Six kids, two adults, an eight-hour train trip. Nothing could go wrong. But Jérôme and André miss the train… and watch it leave the station with the kids on board. It’s the beginning of a crazy race for the unlikely duo. While the unsupervised children go wild and have the time of their life, André and Jérôme go through various delays and adventures…","['BE', 'FR']","['Piste Rouge', 'uMedia', 'uFund', 'Les Films du Castel']","['', 'BE', 'BE', '']",5.1,362,nm1255755,"nm4623867,nm4623690,nm1255755,nm4620935"
395,tt10405142,Qu'est-ce qu'on a tous fait au Bon Dieu ?,2021,98.0,Comedy,False,"Claude and Marie Verneuil will soon be celebrating their 40th wedding anniversary. For the occasion, their four daughters - Isabelle, Odile, Ségolène and Laure - decide to organize a big surprise party in their family home in Chinon. They also decide to invite, each, the parents of their respective husbands - Rachid Benassem, David Benichou, Chao Ling and Charles Koffi.",['FR'],"['UGC', 'Orange Studio']","['FR', 'FR']",6.1,3229,nm0154385,"nm0491230,nm0154385"
