,tconst,originalTitle,startYear,runtimeMinutes,genres_x,adult,overview,production_countries,production_companies_name,production_companies_country,averageRating,numVotes,directors,writers
695,tt16491386,En même temps,2022,108.0,Comedy,False,"On the eve of a vote to greenlight the construction of a leisure centre where a primal forest currently stands, an unashamedly right-wing mayor sets out to trap his ecologist opponent. But both will end up being outwitted by a group of feminist activists who will confront the two men with their own contradictions, once and for all.",['FR'],"['Ad Vitam Production', 'No Money Productions']","['FR', '']",5.7,496,"nm0218022,nm1086956","nm0218022,nm1086956"
696,tt1651084,Holiday,2010,90.0,"Comedy,Crime,Mystery",False,,['FR'],"['Papaye', 'Josy Films', 'Les films du Worso']",,5.7,206,nm0630112,"nm0630112,nm3566256,nm0693898"
697,tt1653874,Je vous aime très beaucoup,2010,91.0,"Comedy,Drama,Family",False,"When the mother they have never known dies, three half brothers aged 8, 15 and 17 respectively, who were all brought up in different ways, meet for the very first time. They spend the long summer holidays with Nonna, their grandmother, and start sharing secrets and rabbits, polenta and mean tricks, adventures and first time experiences, together. At last their once solitary lives take a new direction.",['FR'],['Mazel Productions'],,5.5,126,nm1078935,"nm1078935,nm3354972"
698,tt1655413,Le magasin des suicides,2012,79.0,"Animation,Comedy,Musical",False,"In a cold French city where suicide is a common urge, there is a colorful shop, managed for many years by the Tuvache family, where it is very easy to obtain the necessary tools to satisfy the sinister desires of so many depressed citizens.","['BE', 'FR', 'CA']","['ARP Sélection', 'Caramel Films', 'Diabolo Films', 'La Petite Reine', 'France 3 Cinéma', 'Entre Chien et Loup', 'RTBF']",,6.2,8364,nm0496312,"nm0496312,nm0856628"
699,tt1655442,The Artist,2011,100.0,"Comedy,Drama,Romance",False,"Hollywood, 1927: As silent movie star George Valentin wonders if the arrival of talking pictures will cause him to fade into oblivion, he sparks with Peppy Miller, a young dancer set for a big break.","['BE', 'FR']","['uFilm', 'La Petite Reine', 'Studio 37', 'La Classe américaine', 'JD Prod', 'France 3 Cinéma', 'Jouror Productions']",,7.9,246740,nm0371890,nm0371890
700,tt1659611,Le grand partage,2015,102.0,"Comedy,Drama",False,"An unusually cold winter forces the french government to push the best housed people to accommodate some poor fellow citizens. The decree called ""Le Grand Partage"" creates some trouble among the residents of a Paris upscale apartment block.",['FR'],['Pan Européenne Production'],[''],5.2,1132,nm1464507,nm1464507
701,tt1663321,Poulet aux prunes,2011,93.0,"Comedy,Drama",False,"Nasser-Ali, a talented musician, loses the will to live after his wife breaks his beloved violin during an argument. He searches for a replacement, and finding none that sounds quite the same, he vows to die. Eight days later, he does. This is the story of his last week of life, where we see flashbacks and flash forwards of his previous life and his children's futures. We also see appearances of a nude Sophia Loren as well as the angel of death, Azarel. As we see his life, we realize exactly why he chose to end it and the profundity of this choice.","['BE', 'FR', 'DE']","['Celluloid Dreams', 'TheManipulators']",,7.0,9879,"nm1749112,nm2277869","nm2277869,nm1749112"
702,tt1667100,La chance de ma vie,2010,87.0,"Comedy,Romance",False,"Julien Monnier has a serious problem. Though he's a brilliant couples counselor, he can't keep a woman in his life for more than two weeks. Indeed, ever since his childhood, Julien jinxes every woman who falls in love with him. But it's not just any small jinx. It's the kind that sends you to the hospital several times a week, that destroys your professional life or that turns your friends into enemies. Julien is strictly speaking a true black cat for women. Joanna Sorini will soon learn this at her expense the day she meets him. A career that's just taking off, a love life that finally seems to be taking a good turn, all that may just change.","['BE', 'FR']","['Fidélité Films', 'SCOPE Pictures', 'Jerico', 'Wild Bunch', 'Mars Films', 'TF1 Films Production']",,6.1,2647,nm0190988,"nm2236676,nm1668171"
703,tt1669694,Une pure affaire,2011,88.0,"Action,Comedy,Crime",False,An attorney stumbles upon a suitcase filled with cocaine.,['FR'],"['Quad Productions', 'Chaocorp', 'Profidev', 'La Compagnie Cinématographique', 'Panache Productions', 'TPS Star', 'La Région Île-de-France', 'PROCIREP', 'Canal+']",,5.7,602,nm2056306,"nm2056306,nm1873918"
704,tt1671584,Tante Hilda!,2013,89.0,"Animation,Comedy,Family",False,"Plant loving Hilda, has created a museum where she preserves endangered and rare plants from all over the world. Meanwhile Attilem, a new genetically modified cereal, is launched on the market. Growing with little water and fertilizer while generating high crop field Attilem looks like an ideal solution to eradicate starvation and provide an alternative to diminishing oil reserves. But nothing is at it seems...","['FR', 'LU']","['Folimage', 'Melusine Productions', 'Société Nouvelle de Cinématographie (SNC)', 'Auvergne-Rhône-Alpes Cinéma', 'France 3 Cinéma']",,6.2,155,"nm0157345,nm0320868","nm0320868,nm0157345,nm0853451"
705,tt1673702,Une vie de chat,2010,70.0,"Adventure,Animation,Comedy",False,"A thrilling mystery that unfurls in the alleys and on the rooftops of the French capital, Paris, over the course of one adventurous evening.","['FR', 'NL', 'CH', 'BE']","['Folimage', 'Digit Anima', 'France 3 Cinéma', 'Gébéka Films']",,6.9,11748,"nm0271246,nm0300944","nm0300944,nm0320868"
706,tt1674057,Et si on vivait tous ensemble?,2011,96.0,"Comedy,Drama",False,Five old friends decide to move in together as an alternative to living in a retirement home. Joining them is an ethnology student whose thesis is on the aging population.,"['DE', 'FR']","['Les Films de la Butte', 'Rommel Film', 'Manny Films']",,6.7,3017,nm1416796,nm1416796
707,tt1675434,Intouchables,2011,112.0,"Biography,Comedy,Drama",False,A true story of two men who should never have met – a quadriplegic aristocrat who was injured in a paragliding accident and a young man from the projects.,['FR'],"['Gaumont', 'CinéCinéma', 'Quad Productions', 'Chaocorp', 'Ten Films', 'TF1', 'Canal+', 'TF1 Films Production']",,8.5,905787,"nm0619923,nm0865918","nm0619923,nm0865918,nm4778840"
708,tt1688064,Bye Bye Blondie,2012,87.0,"Comedy,Drama",False,A love story of two women who meet up in their late forties and attempt to retrieve the romance they had in their youth.,"['BE', 'FR', 'CH']","['Wild Bunch', 'Vega Film', 'Red Star Cinéma', 'Frakas Productions', 'Master Movies', 'Garance Capital', 'RTBF', 'Tarantula', 'Belgacom']",,5.2,727,nm0221591,nm0221591
709,tt1688070,Mon pote,2010,105.0,"Comedy,Crime,Drama",False,"The story of a friendship between Victor, owner of a magazine, and Bruno, a car thief.",['FR'],['Les Films du Kiosque'],,6.0,351,nm0261181,"nm0261181,nm3979534"
710,tt1690389,Vous n'avez encore rien vu,2012,115.0,"Comedy,Drama",False,"From beyond the grave, celebrated playwright Antoine d'Anthac gathers together all his friends who have appeared over the years in his play ""Eurydice."" These actors watch a recording of the work performed by a young acting company, La Compagnie de la Colombe. Do love, life, death and love after death still have any place on a theater stage? It's up to them to decide. And the surprises have only just begun...","['DE', 'FR']","['CNC', 'F Comme Film']",,6.5,1661,nm0720297,"nm0720297,nm0004124,nm0030478"
711,tt1692206,Opération 118 318 sévices clients,2010,88.0,Comedy,False,"A few weeks before the elections, the bankruptcy filing of the call center would be a mess and would seriously hurt the parachuting of Segondas, the boss of the bank. Equipped with his BlackBerry and his laptop, Matthieu expects an easy mission. Now, the parachuting of Mathieu in the world of ""phoning"", customer service is not going as planned.",['FR'],['118 Productions'],,3.9,73,nm3987563,"nm2196314,nm0169291,nm3990099"
712,tt1692214,Monsieur Papa,2011,86.0,Comedy,False,"Monsieur Papa is a moving portrait of a modern family, centering around 12 year-old Marius Vallois. Born in a wealthy family, Marius is the son of Marie Vallois, a successful CEO. Marie loves her son unconditionally, but Marius has never known his father and suffers greatly from it. When Marius starts shoplifting and doing badly at school, Marie decides to recruit a father figure for him. One day in her office building, she meets Robert Pique. Robert is a peculiar man who has a background in finance, but makes ends meet ironing clothes for his neighbors. Reluctant at first, Robert agrees to be paid to meet Marius and pretends to be his father. Marius immediately understands that Robert is not his dad, but very quickly, a deep bond develops between them.",['FR'],"['Pathé', 'Arcadia']",,5.5,499,nm0580101,"nm0154307,nm1966750,nm0885408"
713,tt16983432,10 jours encore sans maman,2023,96.0,Comedy,False,"After Antoine was fired from his job, he became a stay-at-home dad taking care of his four children, while his wife Isabelle restarts her career as a lawyer. For Antoine, the family's upcoming ski vacation is a godsend: he can finally take a break from parenthood and enjoy a luxury ski resort! But just as they are about to step on the train, Isabelle is called back to work for an emergency and Antoine has to deal, on his own, with his four mischievous kids going wild on the slopes and in the fancy hotel, as the trip turns into total chaos…",['FR'],"['Soyouz Films', 'StudioCanal', 'M6 Films']","['FR', 'FR', 'FR']",4.7,214,nm0076307,"nm0076307,nm3457034,nm1409431"
714,tt1700467,L'art d'aimer,2011,85.0,"Comedy,Romance",False,"The Art of Love is composed of several chapters, which follows several Parisian couples.",['FR'],['Moby Dick Films'],,6.1,1840,nm0609981,nm0609981
715,tt17040210,La grande magie,2022,110.0,"Comedy,Drama,Musical",False,"The 20s. In a seaside resort where everybody is bored, Albert Marvuglia, a slightly shabby conjurer, makes Marta, the wife of the wealthy bourgeois Charles Moufflet, disappear, who takes advantage of this tour to escape for good.",['FR'],[],[],5.0,133,nm0527852,"nm3944920,nm0208370,nm3523995,nm0527852,nm0786905,nm1444949"
716,tt17049058,La très très grande classe,2022,105.0,Comedy,False,"After five years enduring horrible work conditions, Sophia finally gets chosen for a long-awaited transfer from her thankless teaching job at a rough middle school. Ecstatic to start a new life teaching at the French Lycée in Barcelona, her hopes are dashed to bits when a well- connected, over-qualified teacher at an upscale Paris school cuts in to take the position. Determined to stand her ground, Sophia and her clever neighbour Mr. Picard join forces to sabotage her competitor’s candidacy.","['BE', 'FR']","['Les Films du 24', 'uMedia', 'TF1 Films Production']","['FR', 'BE', 'FR']",4.8,190,nm0704322,nm0704322
717,tt17049070,Jumeaux mais pas trop,2022,98.0,Comedy,False,"Grégoire Beaulieu learns that he has a twin brother: Anthony Girard. Gregoire is bourgeois, ambitious and promised to a great career, Anthony has no prospect and lives of shenanigans. The two brothers couldn’t be more opposite. Especially when one is white and the other is black !",['FR'],['Nac Films'],['FR'],5.5,598,"nm5810182,nm3777273","nm0179366,nm8081957,nm0061085,nm3777273,nm5810182"
718,tt17049104,On sourit pour la photo,2022,95.0,Comedy,False,"Thierry is convinced that the best is behind him. When Claire, his wife, tired of «it was better before», announced that she is leaving him, Thierry, devastated, decided to go back to Greece where they spend their best family holidays 20 years ago. Officially, he wants to spend one last week with their children before announcing their separation. Unofficially, he hopes to win back his wife... By trying to rekindle the flame of his couple, Thierry may well set his family on fire...",['FR'],"['Radar Films', 'Orange Studio', 'UGC Distribution']","['FR', 'FR', '']",5.7,240,nm2970184,nm2970184
719,tt17049112,La revanche des Crevettes Pailletées,2022,113.0,Comedy,False,"Two years after the death of Jean, Matthias, the coach, decides to take Selime, a young man from the suburbs he believes is gay, to accompany the Shiny Shrimps to the Gay Games in Tokyo, on a trip to pay tribute to their friend who left too early. But after they miss their connection, they find themselves stranded in Russia, in one of the not the most gay-friendly regions in the world. The start of a crazy adventure as incredible as it is perilous.",['FR'],"['Kaly Productions', 'Apple Tree Vision', 'Les improductibles']","['', '', '']",6.3,439,"nm9009942,nm4355349","nm2310700,nm4355349,nm9009942"
720,tt17058536,Les gagnants,2022,85.0,Comedy,False,"Two winners of a contest will spend a week in Marseille with their idol, filmed live on social media. Problem: the two winners are trouble.",['FR'],['ARP Sélection'],['FR'],3.1,90,"nm11118562,nm3299162","nm11118562,nm3299162"
721,tt1708526,Halal police d'État,2011,98.0,"Comedy,Crime",False,"Someone is killing Parisians of Arab ethnicity. When an Algerian diplomat is murdered by the same assailant, two Algerian detectives are sent to help the French with the investigation and they have their own ways of doing things.",['FR'],['EuropaCorp'],,3.9,895,nm3183376,"nm0431956,nm0066080"
722,tt1711484,La conquête,2011,105.0,"Biography,Comedy,Drama",False,A look at French president Nicolas Sarkozy's rise to power.,['FR'],"['Mandarin Film', 'Gaumont']",,6.3,1691,nm0244378,"nm0745377,nm0244378"
723,tt1715356,Tous les soleils,2011,105.0,Comedy,False,"Alessandro teaches musicology at the university of Strasbourg. He is also a volunteer reader in hospitals. He shares his apartment with his daughter, 15-year-old Irina, and his anarchist brother Luigi. Life is not always rosy at Alessandro's for three main reasons : he is a widower and has never really recovered from the death of his young wife ; his brother is some kind of parasite who refuses to sell his paintings to capitalist speculators and so to contribute to the cost of the household ; Irina, whom he has raised alone since she was five months old and always felt close to, is rapidly changing from little girl to teenager and wishes to be treated as such. One day, Florence, a beautiful young woman, gets into Alessandro's life. Will he eventually take his chances with her? And will he manage to stop stifling Irina? And will he finally get on with Luigi?",['FR'],['Union Générale Cinématographique (UGC)'],,6.9,1926,nm1061623,nm1061623
724,tt1715881,Une folle envie,2011,81.0,Comedy,False,"Yann and Rose are young, they love and want to have a child. Nine months later ... still no baby in sight. They then show great imagination and try everything ... no matter what it is.  But  they wish so hardly to be three that, is not likely they finish all alone?",['FR'],"['Les Films du Kiosque', 'SND', 'TPS Star']",,4.7,179,nm1600822,"nm1900187,nm1600822"
725,tt1717158,Low Cost,2010,86.0,Comedy,False,"Passengers on a low cost flight from Djerba to Beauvais have their patience tested to destruction when their departure is delayed for eight hours because of a fault with the plane's air-conditioning. In the end, they are so fed up that they will do almost anything to get back home.",['FR'],['Alvy Productions'],,4.6,927,nm0058713,"nm0058713,nm2131687"
726,tt1718801,Il reste du jambon?,2010,90.0,"Comedy,Romance",False,Djalil Boudaoud and Justine Lacroix are a surgeon and a television reporter who enter a romantic relationship despite the objections of their families to the cultural gap.,['FR'],['Gaumont'],,4.6,557,nm1125677,"nm1125677,nm1085510,nm0066080"
727,tt1718835,Mon pire cauchemar,2011,103.0,"Comedy,Drama,Romance",False,"Agathe runs an art gallery. Her husband François is a publisher. Together they have one son, and in every way seem to be the picture of normality — but emotions are stewing under the surface. All it takes is the arrival of a complete stranger for things to start unravelling. Patrick is brash, uncouth and totally unselfconscious...",['FR'],"['CinéCinéma', 'Ciné-@', 'Maison de Cinema', 'F.B. Productions', 'Pathé', 'M6 Films', 'Entre Chien et Loup', 'Artémis Productions', 'Belgacom', 'Ciné+', 'M6', 'Tax Shelter Film Funding', 'Casa Kafka Pictures', 'Casa Kafka Pictures Movie Tax Shelter Empowered by Dexia', 'Canal+', 'RTBF']",,6.0,3142,nm0284774,"nm0284774,nm1228287"
728,tt1721478,Mariage à Mendoza,2012,91.0,"Comedy,Drama",False,"Marcus and his brother Antoine head to Argentina for their cousin’s wedding. They plan to explore all that Buenos Aires has to offer before making the trip to Mendoza in the west. Marcus is thrilled to be on the road and determined to have fun, while Antoine is depressed after being dumped by his wife, who refused to come with them at the last minute. Marcus will do anything it takes to cheer up his little brother. After a very caliente evening in the capital, they hit the road, discovering Argentina vineyard’s and making unlikely encounters –with a crackpot receptionist, a divine beauty, a pregnant ewe, and a guy afflicted by Stendhal syndrome –until, at the end of their journey, the two brothers find peace.","['BE', 'FR', 'AR']","['Direct Cinéma', 'Bizibi', 'Campo Cine', 'Versus Production']",,6.3,411,nm1435120,"nm4396038,nm1435120,nm1662707,nm0714235"
729,tt1723642,Sur la piste du Marsupilami,2012,105.0,"Adventure,Comedy,Family",False,"When reporter Dan Geraldo (Alain Chabat) arrives in Palombia to hunt for a scoop, he never suspects that he is about to make an incredible discovery... With his resourceful local guide Pablito (Jamel Debbouze), D an has one surprise after another during a thrilling adventure that allows him to bring the world some spectacular news: the Marsupilami, a mythical and mischievous animal, really does exist! You too will believe in furry tails!","['BE', 'FR', 'MX']","['Pathé', 'Canal+', 'SCOPE Pictures', 'TF1 Films Production', 'Chez Wam']",,5.5,4168,nm0149260,"nm0149260,nm0232442,nm1096706"
730,tt1726889,On ne choisit pas sa famille,2011,103.0,Comedy,False,"César Borgnoli, an unsuccessful car salesman from Italy, lives well beyond his means. In order to get out of his financial disaster, he agrees to a deal: he pretends to be the husband of his sister's girlfriend Kim so she can legally adopt a little girl from Thailand. Caesar believes this to be a great idea and is looking forward to his trip to Thailand. After all, he is going to be able to mix business with pleasure--so he thinks. He didn't expect the local police, the Chinese Triads and the director of the orphanage to chip in, who want to make sure that little Mai is going to end up in a nice family.",['FR'],"['Les Films du Kiosque', 'Ouille Productions', 'Studio 37', 'Aurel Films', 'TF1 Films Production', 'Kinology', 'Universal Pictures']",,5.6,1778,nm0002010,"nm0002010,nm0217033"
731,tt1728130,Kill Me Please,2010,95.0,Comedy,False,"Doctor Kruger dreams to insert “the suicide in modernity”. He offers to his patients the service of a private clinic where one can die in all peace, champagne glass to the hand. But in the private clinic of “ideal death”, nothing occurs as envisaged.","['FR', 'BE']","['OXB Productions', 'Les Armateurs', 'La Parti Production']",,6.3,972,nm1135265,"nm1135265,nm1522531,nm1166131"
732,tt1729630,10 jours en or,2012,95.0,"Comedy,Drama",False,"When a carefree bachelor is unexpectedly left in charge of a young boy, the two embark on a road trip that will change both of their lives.",['FR'],"[""Loin Derrière L'Oural"", 'France 3 Cinéma']",,5.9,1043,nm1870725,nm1870725
733,tt1730697,Hollywoo,2011,107.0,Comedy,False,"Sometimes, when you think you have it all, everything falls apart. That is exactly the story of Jeanne .Just when she is offered the chance to dub famous American actress Jennifer Marshall in a successful American TV Show and her salary is about to triple, Marshall decides to withdraw from the show. So Jeanne makes a crazy decision, fly to Hollywood herself and make Jennifer change her mind about leaving the series...",['FR'],['StudioCanal'],,5.1,1936,"nm1147848,nm4092503","nm4093470,nm1566456,nm4092503,nm2403162,nm8566158"
734,tt1730701,La planque,2011,89.0,"Comedy,Crime",False,,['FR'],['EuropaCorp'],,5.1,261,nm0411236,nm0618715
735,tt1736636,Poupoupidou,2011,102.0,"Comedy,Crime,Mystery",False,"The ambiguous suicide of a local beauty, weathergirl, cheese model, and Marilyn Monroe look-a-like finds an eager sleuth in David Rousseau, best-selling crime novelist. When Rousseau visits a remote Alps village for the reading of his friend's will he unwittingly, but irresistibly, gets caught in the tangled web of murder and small town politics in this off-beat mystery.",['FR'],"['France 2 Cinéma', 'Diaphana Films']",,6.6,2767,nm0404080,"nm4468810,nm0404080,nm0758118"
736,tt1744826,Au cas où je n'aurais pas la palme d'or,2011,80.0,"Biography,Comedy,Family",False,"Simon, a forty-year-old filmmaker, is more prone to shooting himself in the foot than he is to shooting films. After losing a bet, he shaves off his hair and discovers a strange bump on top of his scull. Believing he's got a terminal illness, he gathers his family, friends and actors at his house in the Lilas neighborhood in Paris to shoot the comedy of his life !",['FR'],['Films de la bosse'],,5.9,39,nm0169699,nm0169699
737,tt1744857,Un jour mon père viendra,2012,99.0,Comedy,False,"Bernard - advanced rich snob, Gustave - the poor prodigal alcoholic. Both are absolutely sure that they are the fathers of Chloe and go along on her quest. Imagine their surprise when it turns out that Chloe's father's place is already occupied by an imposter...",['FR'],['Karé Productions'],,5.6,422,nm1329170,"nm0818890,nm1329170"
738,tt1753535,Au bistro du coin,2011,80.0,Comedy,False,,['FR'],['EuropaCorp'],,3.5,102,nm0625896,"nm0856493,nm4138016,nm1132203"
739,tt1753584,Chroniques sexuelles d'une famille d'aujourd'hui,2012,85.0,"Comedy,Drama,Romance",False,Three generations of a French family open up about their sexual experiences and desires after young Romain is caught masturbating in his biology class.,['FR'],"['Toloda', 'Monkey Pack Films']",,5.3,4611,"nm0036331,nm0000852","nm0021658,nm0036331"
740,tt1753673,De l'huile sur le feu,2011,100.0,Comedy,False,A funny comedy about the war suddenly started between two restaurant owners families.,['FR'],"['Récifilms', 'Axel Films']",,4.3,220,nm1318381,"nm1318381,nm3878285,nm1557889,nm3457034,nm4439287"
741,tt1753792,"Et soudain, tout le monde me manque",2011,98.0,"Comedy,Drama",False,"Justine, struggles with commitment, listens to old David Bowie covers, and uses her employer’s private MRI machines to make “X-Ray Art”  After a trail of boyfriends, Justine thinks she has found The One, a hunky shoe salesman, but her temporary happiness is thrown when her neurotic 60-year-old Jewish father (Michel Blanc) suffers a delayed midlife crisis and announces that his young second wife is expecting a baby.  Justine and her half-sister Dom, who is trying to adopt, are rather annoyed at the news.  Coupled with resentment about her father’s absence when she was growing up, causes her to spiral into self-doubt. Overflowing with French charm, Justine gets by with the help of her family, friends, and newly discovered muse.",['FR'],"['TFI Films Productions', 'Sofimage', 'CinéCinéma', 'TPS Star', 'Union Générale Cinématographique (UGC)']",,6.5,1647,nm2761475,"nm2761475,nm1557889,nm4439287"
742,tt1754455,L'apprenti Père Noël,2010,80.0,"Animation,Comedy,Family",False,"Santa doesn't want to retire, but rules are rules and he must train someone to replace him. The lucky winner, to be chosen from among millions of children, must be named Nicholas, be an orphan and have a pure heart. On the other side of the planet, there is a little boy who is a perfect match, but his lack of self-confidence and fear of heights make him a poor contestant. Will Santa agree to step down, and help his apprentice take his place?","['AU', 'FR', 'IE']","['Cartoon Saloon', 'Bishop Studios LLC']",,6.3,514,"nm2613084,nm0896139",nm2344327
743,tt1754946,Ni à vendre ni à louer,2011,77.0,Comedy,False,A comedy about funny adventures of the group of French people during the summer vacation.,['FR'],"[""Loin Derrière L'Oural"", 'CinéCinéma', 'Canal+']",,5.6,411,nm3258082,"nm3258082,nm4628776"
744,tt1757912,"Titeuf, le film",2011,87.0,"Animation,Comedy,Family",False,"Titeuf is a comic series created by Swiss draughtsman Zep (real name Philippe Chapuis) depicting the life of a young boy (the title's namesake Titeuf, ""Tootuff"" in the English translation) and his vision of the adult world & themes such as love, sex, seduction and mysteries about the girls.  In this film, Titeuf (Donald Reignoux) is off on a new comedic adventure! Things get complicated when Nadia (Melanie Bernier) doesn’t invite Titeuf to her birthday party, which is surely the most horrible moment of his life. Before long, Titeuf’s whole life is turned upside down when his parents are nearly deported. Everything continues to spiral out of control even in the midst of Titeuf’s exhaustive attempts to make matters right.","['FR', 'CH']","['Pathé Distribution', 'RTS']",,5.8,705,nm1086937,nm1086937
