,tconst,originalTitle,startYear,runtimeMinutes,genres_x,adult,overview,production_countries,production_companies_name,production_companies_country,averageRating,numVotes,directors,writers
1102,tt4024546,Bis,2015,98.0,"Comedy,Fantasy",False,"Éric and Patrice have been friends since high school. Over the years, they have both taken very different paths: Éric has become a hedonist, has a string of girlfriends and is always on the look out for a new one; Patrice has become a monogamous father with a very ordered life. After a drunken evening, the two childhood friends find themselves cast back into 1986, when they were 17 years old. This return to the past is a dream opportunity to try to change the path their lives will take. What will they do with this second chance?",['FR'],"['EuropaCorp', 'Few', 'TF1 Films Production']",,5.5,1751,nm0268543,"nm0268543,nm1141181,nm0478799,nm1272853,nm3610886,nm2830075,nm1597648"
1103,tt4025194,Je suis à vous tout de suite,2015,100.0,Comedy,False,"Charming thirty-year-old Hanna Belkacem has inherited the gene from her parents: she is unable to say no. And as she is the Director of Human resources of a big firm such infirmity is not without its problems, particularly when she has to fire someone. The only solution she has found to be forgiven is to... get l* with the men she lays off!",['FR'],"['Delante Films', 'Karé Productions']","['', 'FR']",6.0,676,nm1928581,"nm1928581,nm1098171"
1104,tt4032428,"Robin des Bois, la véritable histoire",2015,87.0,"Adventure,Comedy",False,"Robin des Bois, with his friend Tuck, are bad guy: they only steal poor, women and old people. They dream to get they own brothel in town, like the Pussycat. They decide to rob Nottingham's tax office, but they meet the Sherwood gang - who steal to rich to feed the poors - with the same idea in mind: Robbing the Nottingham sherif. The true story of Robin des Bois can finally begins!",['FR'],"['M6 Films', 'Mars Films']",,4.2,509,nm4996483,"nm0991511,nm4996483"
1105,tt4032450,Le talent de mes amis,2015,98.0,Comedy,False,A man in his mid 30's reevaluates his life and priorities after he met someone from his past.,['FR'],['Same Player'],,5.1,459,nm3367478,"nm3739849,nm3367478,nm0760850"
1106,tt4035268,Cosmos,2015,103.0,"Comedy,Crime,Drama",False,Two young men seek the solitude of the country; their peace is disturbed when a set of random occurrences suggest to their susceptible minds a pattern with sinister meanings.,"['PT', 'FR']","['Leopardo Filmes', 'Alfama Films']",,5.7,2147,nm0958558,"nm0958558,nm0326822"
1107,tt4040042,La fille du patron,2015,98.0,"Comedy,Drama,Romance",False,"40-year-old foreman Vital is chosen by Alix (25) as a guinea pig in the anonymous study she is carrying out in her father's factory.  The boss's daughter soon finds herself falling under the spell of this reserved, enigmatic worker as he begins to open up to her, revealing his dreams of another life.",['FR'],['Bethsabée Mucho'],,5.4,818,nm0522151,"nm1379151,nm2409312,nm0522151"
1108,tt4057632,Nous trois ou rien,2015,102.0,"Comedy,Drama",False,"An Iranian family survives the shah and the ayatollah and moves to France. This story follows the family through it all. Despite the politics, revolution, prison, beatings, assassinations and suicides this is a comedy.",['FR'],"['Adama Pictures', 'M6', 'Gaumont', ""Ali'n Productions""]","['', 'FR', 'FR', 'MA']",7.2,2644,nm4595176,nm4595176
1109,tt4058218,Ange et Gabrielle,2015,91.0,"Comedy,Romance",False,"Gabriell is a single mother, her 17-year-old daughter Claire is pregnant, however the child's father Simon has no desire to be involved with his future baby. When Gabrielle takes matters into her own hands and asks Simon's father Ange for help, an unexpected relationship begins.",['FR'],['Benji Films'],['FR'],5.8,1055,nm1199305,"nm1909070,nm1199305,nm0494504"
1110,tt4075488,Je suis mort mais j'ai des amis,2015,96.0,Comedy,False,"Four bearded, hairy rock musicians - and Belgians - bury the singer of their group. Out of friendship and to prove to itself that nothing can stop them, they decide to leave on tour to Los Angeles with its ashes. The day before the departure, a serviceman with a moustache appears as the lover of their friend. Their journey takes an at least unexpected tour ...","['BE', 'FR']","['TS Productions', 'Versus Production']","['FR', 'BE']",6.3,397,"nm0347029,nm1166131","nm0347029,nm1166131,nm0851759"
1111,tt4080672,Papa ou maman,2015,85.0,"Comedy,Drama,Romance",False,"Florence and Vincent Leroy are a model couple. They have great jobs, a perfect marriage and delightful children. And now they want their divorce to be an equal success. But when they are both simultaneously promoted to their dream jobs, their relationship becomes a nightmare. From that moment on, the gloves are off, the two exes declare war and will do everything in their power to NOT have custody of their children.",['FR'],"['Chapter 2', 'M6 Films', 'uMedia', 'Pathé', 'Fargo Films']",,6.0,4719,nm1113528,"nm1141181,nm0478799,nm1584563,nm1768176"
1112,tt4084056,Le goût des merveilles,2015,100.0,"Comedy,Drama,Romance",False,"Louise, a widow with two children, almost crushes a stranger with her car. She takes care of him, even if he's not really wounded. It turns out that he has mental disorders and that they can help each other much more than they thought.",['FR'],"['Caméra One', 'Pulsar Productions']","['FR', '']",6.8,3219,nm0078704,nm0078704
1113,tt4085944,Lolo,2015,99.0,Comedy,False,"On holiday in the south of France, chic Parisian sophisticate Violette meets life-loving IT geek Jean-René. Against all odds, there’s a real chemistry between them and at the end of the summer, Jean-René wastes no time in joining his beloved in Paris. But there’s trouble in paradise, and a third party swiftly appears to shatter the couple’s idyll: Lolo, Violette’s ultra-possessive 19-year-old son, who is determined to get rid of his mother’s lover, whatever it takes…",['FR'],"['Mars Film', 'The Film', 'France 2 Cinéma', 'Tempête Sous Un Crâne Productions']",,5.7,4357,nm0000365,"nm0000365,nm3032208"
1114,tt4161564,L'effet aquatique,2016,83.0,"Comedy,Drama,Romance",False,"Samir, a lanky crane operator in Montreuil, falls madly for Agathe. As master swimmer at the pool Thorez he decides to take swimming lessons with her. But the lie does not last three lessons - Agathe hate liars. Chosen to represent the Seine-Saint-Denis, Agathe flies to Iceland for the 10th Congress of the International Masters Swimming. Samir has no choice but to fly in turn also.","['FR', 'IS']","['Agat Films & Cie / Ex Nihilo', 'Zik Zak Filmworks']","['FR', 'IS']",6.2,1115,"nm0030681,nm0300858","nm0030681,nm0300858"
1115,tt4161586,Et ta soeur,2015,95.0,"Comedy,Drama,Romance",False,"Mourning his brother's recent death, Pierrick accepts his best friend Tessa's invitation to stay in her family home — at last, a week alone. But when her gets there, he finds the house already occupied by Tessa's sister Marie.",['FR'],['Les Films du Kiosque'],['FR'],5.4,475,nm0894742,"nm0894742,nm1119645"
1116,tt4161632,Qui c'est les plus forts?,2015,103.0,"Comedy,Drama,Music",False,"Samantha, who works in a chicken factory in Saint-Étienne, loses her job. She lives with her best-friend Céline. She is also her little sister Kim's guardian and must find another job quickly or run the risk of losing her sister. She meets Paul, a lawyer who would like to raise a child with his partner. As a result, he asks Samantha if she would like to be hired as his surrogate.",['FR'],"['Wild Bunch', 'M6 Films', 'Someci', 'Ciné-@']",,5.3,194,nm0876942,"nm2959021,nm0876942"
1117,tt4163636,Floride,2015,110.0,"Comedy,Drama",False,"Although he's now eighty years old, Claude Lherminier is still as imposing as he ever was. But his bouts of forgetfulness and confusion are becoming increasingly frequent. Even so, he stubbornly refuses to admit that anything is wrong. Carole, his oldest daughter, wages a daily and taxing battle to ensure that he's not left on his own. Claude suddenly decides on a whim to go to Florida. What lies behind this sudden trip?",['FR'],"['F Comme Film', 'Ciné-@', 'Gaumont', 'Cinéfrance 1888', 'France 2 Cinéma', 'Auvergne-Rhône-Alpes Cinéma']",,6.5,760,nm0494355,"nm0867374,nm0494355,nm1725469"
1118,tt4163644,Comme un avion,2015,105.0,"Comedy,Drama",False,"Michel, a fifty year old man, graphic designer, decides to change the urban lifestyle and go on an adventure. Fascinated by airmail, he dreams at Jean Mermoz when he's on scooter. One day, Michel sees a picture of a kayak.",['FR'],"['Canal+', 'France 3 Cinéma', 'Why Not Productions']",,6.5,1648,nm0687913,nm0687913
1119,tt4164350,Repas de famille,2014,90.0,Comedy,False,"Auguste Lumière directs four workers in the demolition of an old wall at the Lumière factory. One worker is pressing the wall inwards with a jackscrew, while another is pushing it with a pick. When the wall hits the ground, a cloud of white dust whirls up. Three workers continue the demolition of the wall with picks.",['FR'],['D8 Films'],,3.7,102,nm0758161,"nm0140641,nm0519509,nm0758161"
1120,tt4168470,Une histoire américaine,2015,86.0,"Comedy,Drama,Romance",False,"For the sake of love, Vincent has followed Barbara to New York. But she wants nothing more to do with him. Obsessed with the idea of winning her back, he decides to see things through to the bitter end...",['FR'],['Bocalupo Films'],,5.8,95,nm1802173,"nm2451507,nm6900887,nm1802173,nm0531195"
1121,tt4176556,Les deux amis,2015,100.0,"Comedy,Drama,Romance",False,"Mona, a prisoner on work release, meets Clément, a shy actor. Desperate to impress Mona, Clément recruits his extroverted friend, Abel, to help. When Mona becomes more interested in Abel, it sets off a conflict between the two friends. Meanwhile, Mona attempts to keep her past hidden.",['FR'],['Les Films des Tournelles'],,5.9,2103,nm0308039,"nm0308039,nm0393394"
1122,tt4216890,Baden Baden,2016,96.0,"Comedy,Drama",False,"Charts the trials and tribulations of Ana, a free-spirited 26 year-old returning home to Strasbourg for the summer after living abroad for long enough to feel out of place everywhere.","['BE', 'FR']","['Tarantula', 'ChevalDeuxTrois', 'RTBF', 'Artémis Productions']",,6.5,753,nm4540217,nm4540217
1123,tt4216908,L'hermine,2015,98.0,"Comedy,Crime,Drama",False,"When a feared judge of the French court, Xavier Racine, encounters a French-Danish juror, Ditte Lorensen-Coteret, at a murder trial, their shared past is slowly uncovered.",['FR'],"['Gaumont', 'Albertine Productions']",,6.6,2377,nm0898603,nm0898603
1124,tt4246850,Entre amis,2015,90.0,"Comedy,Drama",False,"Three longtime friends set off on a boat trip with their romantic partners, but inclement weather, jealousy and confessions, will put to test their friendships.",['FR'],"['TF1 Production', 'Eskwad', 'Pathé']",,4.9,764,nm0057842,"nm0078704,nm0334926,nm0057842"
1125,tt4250606,Good Luck Algeria,2015,91.0,"Comedy,Sport",False,"Samir has given much of his time and money developing ski equipments for a Swedish Olympic athlete. When the contract fails, his business partner and closest friend plans to save their company by sending Samir to represent Algeria at the Winter Olympics! Already broke, and expecting his second child, Samir trains to become the first Algerian cross-country skiing male athlete to participate in the winter games. Samir, the eldest son of an Algerian emigrant must first go back to his father's homeland in order to achieve this goal.","['BE', 'FR']",['Les Films Velvet'],['FR'],5.9,334,nm1457966,"nm1457966,nm4380548,nm1342890"
1126,tt4255626,Toute première fois,2015,98.0,"Comedy,Romance",False,"Jérémie, 34, wakes up in an apartment he doesn't know, next to a woman he doesn't know. She is Adna, a stunning Swedish woman who is as funny as she is sweet. Is this the beginning of a fairy tale? Not quite, since Jérémie is about to get married—to Antoine.",['FR'],['Gaumont'],,5.9,1855,"nm4355349,nm2015017","nm4355349,nm2015017"
1127,tt4313608,Paris-Willouby,2015,83.0,"Comedy,Drama",False,"Claire and Maurice have to take the whole family to Claire's father's funeral. This tightly knit family is not only composed of Claire's vegetarian son, Alex, who's secretly fond of Maurice's daughter, Lucie, the teenage rebel, but also Claire's brother, a poet living under his sister's roof; without forgetting young Prune, Claire and Maurice's daughter, who will develop a passion for the country's emblematic cows. They must all strive to get along during the road trip to Willouby.","['BE', 'FR']","['2.4.7. Films', 'Mars Films', 'Panache Productions', 'La Compagnie Cinématographique']","['FR', 'FR', 'BE', 'BE']",5.2,283,"nm4001962,nm4002493","nm4001962,nm4002493,nm1928581"
1128,tt4357368,Asphalte,2015,100.0,"Comedy,Drama",False,"Improbable encounters bring tenderness, laughter and compassion to a world of urban alienation.",['FR'],"['La Caméra Deluxe', 'Maje Productions', 'A Single Man Productions', 'Emotions Films UK', 'Jack Stern Productions', 'Film Factory', 'OCS']",,7.0,3539,nm0996471,"nm0996471,nm0711512"
1129,tt4384186,A Love You,2015,92.0,"Comedy,Romance",False,"After a drunken evening and an unforgettable night with a total stranger, Manu wakes up alone to find a message on his arm giving him an appointment in Avignon. Convinced that the appointment is with the dreamy woman from the night before, he is ready to do anything to find her again.",['FR'],['EuropaCorp'],,5.3,241,nm5602595,nm5602595
1130,tt4386356,Tout pour être heureux,2015,97.0,"Comedy,Drama",False,"Following the breakdown of his marriage, a self-involved man begins to embrace fatherhood.",['FR'],"['France 2 Cinéma', 'Chapka Films', 'Vendôme Production', 'TF1 Droits Audiovisuels']","['FR', 'FR', 'FR', 'FR']",6.2,564,nm1175497,"nm1758832,nm1175497"
1131,tt4400058,Babysitting 2,2015,93.0,Comedy,False,"Franck and his girlfriend Sonya, plus some of their friends go on holiday in Brazil. Franck, his friends, two girls and Sonya's grandmother leave to visit a cave, but everything goes wrong and their crazy adventures begin.",['FR'],"['M6 Films', 'Axel Films', 'Madame Films']",,6.4,7120,"nm1318381,nm3743617","nm5033444,nm1318381,nm3743617,nm6421627"
1132,tt4400086,Vendeur,2016,89.0,"Comedy,Drama",False,"Serge is a winner, he sells kitchen furniture like hot cakes. His son, Gérald, who has just lost his restaurant, applies for a job in his dad's firm. It's Gerald's wish but it's Serge's reality and you do not become a top salesman overnight.",['FR'],"['France 2 Cinéma', 'Sésame Films']","['FR', 'FR']",5.9,201,nm2119371,"nm2119371,nm0520569,nm1550375,nm0275452"
1133,tt4428714,Faut pas lui dire,2016,96.0,"Comedy,Romance",False,"Laura, Eve, Anouch and Yaël are four cousins, very different and very endearing, who have one thing in common: they lie, but always for love! When the first three discover a few weeks before their little cousin's wedding that her perfect fiancé is cheating on her, they vote in unison ""Don't tell him""!","['FR', 'BE']","['Entre Chien et Loup', 'RTBF']","['BE', 'BE']",5.0,511,nm4265813,"nm4265813,nm0015149"
1134,tt4428720,Cerise,2015,90.0,Comedy,False,"Cerise is fourteen years old but she looks twenty. Cerise grew up on the outskirts, but now she's exiled to Ukraine. Cerise wears excessive amounts of makeup, but she still has a little girl's dreams. Cerise doesn't know her father, even though she's going to have to live with him. Cerise has only ever thought about herself and now she finds herself in the middle of a revolution.",['FR'],"['Légende Films', 'Gaumont']",,5.5,220,nm0257991,"nm0257991,nm7195624"
1135,tt4428740,Les malheurs de Sophie,2016,106.0,"Comedy,Drama",False,"Sophie is far from being the model little girl one would like her to be, unlike her friends Camille and Madeleine. She always insists on having her own way, often getting into trouble, to the despair of one and all. But her mother is unbending and otherwise inclined. She will not let her get away with anything, and poor Sophie will often have to live with the consequences of her bad behaviour and learn her lesson.",['FR'],['Gaumont Distribution'],[''],5.3,433,nm0393394,"nm0393394,nm0851522,nm0211903"
1136,tt4428774,Marie et les naufragés,2016,104.0,Comedy,False,"""Marie is dangerous"", Antoine warns. It hasn't stopped Siméon from dropping everything, or, more precisely, letting go the little that he had, to secretly follow her. Oscar, his roommate, a musician with sleepwalking tendencies, and Antoine, a novelist lacking inspiration, quickly follow in his footsteps. Here they all are at the end of the Earth, which is to say, on an island. It's quite possible that these four are linked by something beyond their comprehension. Perhaps simply a taste for adventure. Or the desire to add some fantasy and a touch of the romantic to their lives.",['FR'],[],[],6.1,231,nm1715466,nm1715466
1137,tt4447076,Rosalie Blum,2015,95.0,Comedy,False,"Vincent Machot knows his life by heart. He shares it between his hair dressing salon, his cousin, his cat, and his too-invasive mother. But life sometimes holds surprises, even for the most prudent of people... He crosses paths with Rosalie Blum by accident. She is a mysterious and solitary woman whom he is sure he has already met. But where? Intrigued, he decides to follow her everywhere, in the hope of knowing more about her.",['FR'],"['France 2 Cinéma', 'The Film', 'GC Cinema']","['FR', 'FR', '']",6.8,1327,nm1272853,"nm5676183,nm1272853"
1138,tt4463248,Le fantôme de Canterville,2016,90.0,"Comedy,Family,Fantasy",False,"In the depths of a British legend, the ghost of Eleanor Canterville is condemned to haunt the castle of his family and to scare away any inhabitant. It fulfills this task perfectly, helped by Gwilherm, his faithful servant. But when Otis, a family fleeing Parisian life, buy the castle, Eleanor is upset because she cannot scare this tribe of the twenty-first century. Worse yet, children ridicule and parents are unaware. Only Virginia Otis, aged fifteen, moved by the fate of Canterville Ghost, will seek to deliver from curse on it.",['FR'],['Les Films du 24'],['FR'],4.3,341,nm1077168,"nm0928492,nm1077168"
1139,tt4466362,"Connasse, princesse des coeurs",2015,80.0,Comedy,False,"Thirty-year-old Camilla, realizes that she doesn't have the life she deserves and decides that the only destiny worthy of her is that of a royal princess.","['BE', 'FR']",['LGM Productions'],,5.6,1570,"nm5959317,nm2015017","nm5959317,nm2015017"
1140,tt4466864,Les nouvelles aventures d'Aladin,2015,107.0,Comedy,False,"A pair of losers working at department store plan to rob the place after it closes. When a bunch of kids show up begging for a story, the men launch into an improvised version of Aladdin.",['FR'],"['Artémis Productions', 'M6 Films', '74 Films', 'Pathé']",,4.8,2559,nm2615804,nm0169291
1141,tt4466894,Sahara,2017,86.0,"Adventure,Animation,Comedy",False,A young cobra and his scorpion best friend go on a journey across the Sahara desert to save a new-found love.,"['CA', 'FR']","['Mikros Image', 'Mandarin Film', ""La Station d'Animation"", 'StudioCanal', 'M6 Films', 'Transfilm International']","['FR', 'CN', '', 'FR', 'FR', 'CA']",5.5,3010,nm1764568,"nm1764568,nm0443592,nm3376362"
1142,tt4466936,"Un peu, beaucoup, aveuglément!",2015,90.0,"Comedy,Romance",False,He invents puzzles. He’s committed body and soul to his work and needs silence to be able to concentrate. She is an accomplished pianist and can’t live without music. She must prepare for a competition that could change her life. They are going to be forced to coexist without seeing each other.,['FR'],['Cine Nominé'],,6.6,7017,nm0180404,"nm2524823,nm0180404,nm2056787,nm3457034"
1143,tt4467176,Going to Brazil,2016,94.0,"Comedy,Drama",False,"Four childhood friends are reunited at a wedding in Rio. But when they accidentally kill a young man during a party that gets out of hand, they are forced to flee the city in a crazy adventure.",['FR'],"['Vamonos Films', 'Chapter 2', 'France 3 Cinéma', 'Moonshaker']","['', 'FR', 'FR', 'FR']",5.0,872,nm0587791,"nm0587791,nm0483451,nm5790144"
1144,tt4494706,Tout de suite maintenant,2016,98.0,Comedy,False,"Nora is a bright young professional whose new job at a financial firm turns out to be a trial by fire when she learns that her bosses share a tumultuous history with her prickly mathematician father. Meanwhile, an interoffice romance with a competitive colleague leads to even more complications, leaving Nora to navigate a minefield of delicate relationships as she climbs the corporate ladder.","['LU', 'FR']","['Samsa Film', 'sms productions', 'France 2 Cinéma']","['LU', '', 'FR']",5.7,377,nm0094726,"nm0094726,nm0755389"
1145,tt4505118,Arrête ton cinéma!,2016,90.0,Comedy,False,"Sybille, an accomplished actress, is given the chance to direct a film based on her own screenplay. Everything seems to go well at first. Her producers, two sisters, are two wacky but lovable characters, and Sybille dives into the adventure with them, putting aside her family life. But, from the unlikely choice of actresses, the successive rewrites of the script and the financial issues, the wonderful dream turns into a nightmare. Ever the optimist, Sybille will realise too late that her whimsical and totally crazy producers are going to drag her in their madness ... One thing is certain, nothing will happen as planned.",['FR'],"['La Région Île-de-France', 'Alexandre Films', 'Bac Films', 'OCS']","['FR', 'FR', 'FR', 'FR']",5.0,200,nm0476123,"nm0476123,nm0856500"
1146,tt4505208,La vache,2016,91.0,"Adventure,Comedy,Drama",False,An Algerian man's life-long dream finally comes true when he receives an invitation to take his cow Jacqueline to the Paris International Agriculture Fair.,['FR'],"['Pathé', 'France 3 Cinéma', 'Agora Films']","['FR', 'FR', 'MA']",6.7,2686,nm5627015,"nm0086912,nm4238622,nm5627015"
1147,tt4515544,La tour 2 contrôle infernale,2016,88.0,Comedy,False,"Ernest Krakenkrick and Bachir Bouzouk are about to become pilots in the French army. But after the bad consequences of a test undertaken with the centrifuge, they are forced to give up their dream. They are eventually given the position of baggage handler at Orly-West Airport in Paris. But one night, there is a hostage-taking in the airport and the ""Moustachious"", a group of terrorists, take hold of the control tower.",['FR'],['Cinéfrance'],['FR'],4.2,850,nm0431956,"nm0066080,nm0431956,nm3802745"
1148,tt4523050,Marseille,2016,97.0,"Comedy,Drama",False,,['FR'],"['Janine Films', 'Eskwad', 'LGM Productions', 'Pathé', 'TF1 Films Production']","['FR', 'FR', '', 'FR', 'FR']",5.0,480,nm0580101,"nm0098179,nm0252775,nm0580101"
1149,tt4531006,Je compte sur vous,2015,98.0,"Biography,Comedy,Crime",False,"Biography based on the life of conman Gilbert Chikli who invented the ""CEO scam"" and was able to persuade bank and company officers to transfer money by simply ringing them and impersonating their CEO. He is now living in luxury in Israel.",['FR'],"['France 2 Cinéma', 'Vito Films']","['FR', 'FR']",5.7,411,nm0253018,"nm0253018,nm4380548,nm0789343"
1150,tt4531694,Pattaya,2016,100.0,Comedy,False,"Franky and Krimo dream of leaving the grey grime of their neighborhood behind and of traveling to the famous and diabolical Thai beach resort of Pattaya. To get there cheaply, the two friends have the crazy idea of registering, unbeknownst to him, the local little person for the Thai Dwarf Boxing World Championship. But what was supposed to be a dream vacation will transform into the most insane and dangerous adventure of their lives.",['FR'],['Mandarin Cinéma'],,4.8,1837,nm4151736,"nm4151736,nm0443592"
1151,tt4538708,Tout schuss,2016,96.0,Comedy,False,"Max Salinger, writer divorced, flamboyant and self-absorbed, refuses to welcome her daughter for 15 years under its roof. In revenge, she steals his last manuscript and file class of snow. To retrieve his property, Max has then no choice but to land in the ski resort to improvising ""accompanying parent. Only problem: the famous writer, who is not already an exemplary parent, is not really a qualified nor attendant! EPIC descents in infernal hiking, the life of Max in the mid-teens was not all rest Announces...",['FR'],"['France 2 Cinéma', 'M.E.S. Productions', 'Monkey Pack Films']","['FR', 'FR', 'FR']",4.1,362,"nm4717181,nm4716891","nm4717181,nm7083841,nm1762669,nm5099330,nm4716891"
1152,tt4551314,Un petit boulot,2016,107.0,"Comedy,Crime",False,An unemployed factory worker takes a job as a hit man to make ends meet.,['FR'],"['Gaumont', 'SCOPE Pictures']","['FR', 'BE']",6.4,1865,nm0154312,"nm6396241,nm0003508,nm7217235"
1153,tt4576612,Comment c'est loin,2015,90.0,"Comedy,Drama,Music",False,"After ten years of doing nothing, Orel and Gringe are in their mid 30s and they struggle to finish their first rap album. Their texts are mostly sex jokes and booze stories and reflect the everyday life they have in a small town from France. The problem is that they never really finished a song and when their producers want to meet, they have to face a new challenge : finish their first song in the next 24h. Their old issues, the fear of failure, their alcoholic friends and annoying girlfriends won't help them to do so, or will they ?",['FR'],['Nolita'],['FR'],6.9,2137,"nm0644393,nm4765550","nm4765550,nm0613587,nm0644393"
